{"$schema":"https://json-schema.org/draft/2020-12/schema","$id":"https://axignal.com/schemas/multilingual-document-intelligence-runtime.schema.json","type":"object","additionalProperties":false,"required":["schema_version","task_id","programme_version","status","canonical_activation_authorised","dependency_status","trust_principles","language_profile","document_pipeline","extraction_contract","ocr_contract","anchor_contract","semantic_parity_contract","document_authority_contract","privacy_security_contract","rights_dimensions","quality_contract","observability","acceptance_gate"],"properties":{"schema_version":{"const":"axignal.multilingual-document-intelligence-runtime/v0.1"},"task_id":{"const":"AX-GE2E-P06-T01"},"programme_version":{"type":"string","minLength":1},"status":{"type":"string","minLength":1},"canonical_activation_authorised":{"type":"boolean"},"dependency_status":{"type":"object","minProperties":1},"trust_principles":{"type":"array","minItems":10,"items":{"type":"string","minLength":1},"uniqueItems":true},"language_profile":{"type":"object","required":["languages","parity_dimensions"],"properties":{"languages":{"type":"array","minItems":6,"maxItems":6,"uniqueItems":true,"items":{"type":"object","required":["language_tag","script","reference_locale","name"],"properties":{"language_tag":{"type":"string"},"script":{"type":"string"},"reference_locale":{"type":"string"},"name":{"type":"string"}}}},"parity_dimensions":{"type":"array","minItems":10,"uniqueItems":true,"items":{"type":"string"}}}},"document_pipeline":{"type":"object","required":["stages","default_decision","indeterminate_as"],"properties":{"stages":{"type":"array","minItems":8,"items":{"type":"object"}},"default_decision":{"type":"string"},"indeterminate_as":{"type":"string"}}},"extraction_contract":{"type":"object","minProperties":3},"ocr_contract":{"type":"object","minProperties":3},"anchor_contract":{"type":"object","required":["anchor_types","required_fields","resolution_states","rules"],"properties":{"anchor_types":{"type":"array","minItems":5,"uniqueItems":true,"items":{"type":"string"}},"required_fields":{"type":"array","minItems":8,"items":{"type":"string"}},"resolution_states":{"type":"array","minItems":4,"items":{"type":"string"}},"rules":{"type":"array","minItems":5,"items":{"type":"string"}}}},"semantic_parity_contract":{"type":"object","minProperties":3},"document_authority_contract":{"type":"object","minProperties":3},"privacy_security_contract":{"type":"object","minProperties":3},"rights_dimensions":{"type":"array","minItems":10,"maxItems":10,"uniqueItems":true,"items":{"type":"string"}},"quality_contract":{"type":"object","minProperties":2},"observability":{"type":"object","minProperties":2},"acceptance_gate":{"type":"object","required":["required_before_canonical_activation","current_decision"],"properties":{"required_before_canonical_activation":{"type":"array","minItems":10,"items":{"type":"string"}},"current_decision":{"type":"string"}}}}}