{"schema_version":"axignal.multilingual-document-intelligence-runtime/v0.1","task_id":"AX-GE2E-P06-T01","programme_version":"1.4.0","status":"DRAFT_ENGINEERING_FOUNDATION","canonical_activation_authorised":false,"dependency_status":{"p05_task":"AX-GE2E-P05-T01","p05_engineering_head":"07de87e4ff79b19110394c8901db6a98e0be87b2","p05_engineering_evidence_ready":true,"p05_canonical_activation_authorised":false,"p04_canonical_activation_authorised":false,"p03_canonical_activation_authorised":false,"p02_canonical_activation_authorised":false,"p01_dependency_satisfied":false,"stacked_base_branch":"agent/ax-ge2e-p05-foundational-libraries-v1.4","merge_to_main_allowed":false},"trust_principles":["Source-native bytes, text, language, layout and document versions are immutable references.","OCR, parsing, translation and semantic alignment produce candidates or proposals only.","A translated text never replaces the source text or becomes legal equivalence by automation.","Every extracted assertion must resolve to a version-pinned document anchor.","Unknown language, reading order, date, amount, negation or modality is preserved as unknown.","OCR confidence is local to tokens, blocks and pages and never establishes document authority.","Rights, privacy classification, revocation and document withdrawal override convenience and caches.","Mixed-language and mixed-script documents are segmented rather than forced into one language.","No model, parser, OCR engine, browser, connector or worker can admit canonical document facts.","Semantic parity is evaluated per dimension and per language; aggregate similarity cannot hide a critical mismatch.","Anchors fail closed on document-version, content-digest, geometry or quote-digest mismatch.","Canonical admission requires independent runtime checks and explicit human document authority."],"language_profile":{"languages":[{"language_tag":"en","script":"Latn","reference_locale":"en-GB","name":"English"},{"language_tag":"es","script":"Latn","reference_locale":"es-ES","name":"Spanish"},{"language_tag":"fr","script":"Latn","reference_locale":"fr-FR","name":"French"},{"language_tag":"de","script":"Latn","reference_locale":"de-DE","name":"German"},{"language_tag":"pt","script":"Latn","reference_locale":"pt-PT","name":"Portuguese"},{"language_tag":"it","script":"Latn","reference_locale":"it-IT","name":"Italian"}],"parity_dimensions":["source_identity","document_version","section_structure","obligations","eligibility","amounts","dates","negation","modality","named_entities","taxonomy_codes","citation_anchors"],"source_native_text_immutable":true,"translation_is_legal_equivalence":false,"language_detection_states":["DECLARED","DETECTED","MIXED","UNKNOWN","CONTESTED"],"rules":["BCP 47 language tags and script are explicit.","Locale is not inferred from country alone.","Negation, modality, amounts, dates, named entities and taxonomy codes are critical dimensions.","A missing critical dimension produces REVIEW_REQUIRED or DENY, never PASS.","Machine translation preserves source text, model version, prompt profile and confidence."]},"document_pipeline":{"stages":[{"stage_id":"D01_REFERENCE","input":"DocumentReference","output":"PinnedDocumentReference","authority":"DETERMINISTIC"},{"stage_id":"D02_PREFLIGHT","input":"PinnedDocumentReference","output":"DocumentPreflight","authority":"DETERMINISTIC"},{"stage_id":"D03_NATIVE_EXTRACTION","input":"DocumentPreflight","output":"NativeExtractionCandidate","authority":"CANDIDATE_ONLY"},{"stage_id":"D04_OCR_FALLBACK","input":"DocumentPreflight","output":"OcrExtractionCandidate","authority":"CANDIDATE_ONLY"},{"stage_id":"D05_LAYOUT_RECONSTRUCTION","input":"ExtractionCandidate","output":"LayoutCandidate","authority":"CANDIDATE_ONLY"},{"stage_id":"D06_LANGUAGE_SEGMENTATION","input":"LayoutCandidate","output":"LanguageSegments","authority":"CANDIDATE_ONLY"},{"stage_id":"D07_SEMANTIC_ALIGNMENT","input":"LanguageSegments","output":"SemanticParityProposal","authority":"PROPOSAL_ONLY"},{"stage_id":"D08_ANCHOR_VALIDATION","input":"SemanticParityProposal","output":"AnchorValidationReport","authority":"DETERMINISTIC"},{"stage_id":"D09_HUMAN_ADMISSION","input":"AnchorValidationReport","output":"DocumentAdmissionDecision","authority":"HUMAN"}],"default_decision":"DENY","indeterminate_as":"DENY"},"extraction_contract":{"modes":["NATIVE_TEXT","OCR_TEXT","TABLE_STRUCTURE","FORM_FIELDS","IMAGE_REGION_METADATA"],"required_lineage":["document_id","document_version","content_digest","mime_type","extractor_id","extractor_version","extracted_at","rights_snapshot_id","classification_id"],"candidate_outputs":["TextBlockCandidate","TableCandidate","FormFieldCandidate","ImageRegionCandidate","LanguageSegmentCandidate"],"forbidden_outputs":["AdmittedEvidence","CanonicalClaim","LegalInterpretation","RightsApproval","DocumentAdmission"],"rules":["Native extraction is attempted before OCR unless the format profile requires OCR.","Raw and extracted payload persistence follows the source-rights snapshot.","Hidden text layers and rendered pages are compared when both exist.","Reading order is explicit and reversible.","Tables preserve row, column, span, header and page geometry.","Parser output without raw-reference lineage is quarantined."]},"ocr_contract":{"required_versions":["engine_id","engine_version","language_pack_versions","preprocessing_profile","layout_profile"],"confidence_levels":["TOKEN","LINE","BLOCK","PAGE","DOCUMENT"],"thresholds":{"candidate_min":0.9,"review_min":0.75,"below_review":"QUARANTINE"},"rules":["Confidence is never averaged across a critical low-confidence span.","OCR fallback does not overwrite a valid native text layer.","Image preprocessing is versioned and reversible.","Handwriting and unsupported scripts are marked unsupported or review-required.","Invisible-text disagreement, prompt injection and executable content are quarantined.","OCR engine upgrades require fixture replay before use."]},"anchor_contract":{"anchor_types":["BYTE_RANGE","PAGE_BOX","TEXT_SPAN","SECTION_PATH","TABLE_CELL","IMAGE_REGION"],"required_fields":["anchor_id","document_id","document_version","content_digest","anchor_type","page_index","geometry","quote_digest","extractor_version","created_at"],"resolution_states":["RESOLVED","UNRESOLVED","STALE","AMBIGUOUS","INVALID"],"rules":["Document version and content digest must match exactly.","Page indices and geometry are validated against the rendered version.","Quote digests bind normalized text without replacing source text.","Table-cell anchors include row, column and span coordinates.","A stale or ambiguous anchor contributes zero canonical evidence.","Document amendment or withdrawal invalidates dependent currentness claims."]},"semantic_parity_contract":{"decision_states":["PASS","REVIEW_REQUIRED","DENY","INDETERMINATE"],"critical_dimensions":["obligations","eligibility","amounts","dates","negation","modality","citation_anchors"],"required_evidence":["source_segment_ids","target_segment_ids","source_language","target_language","translation_engine","engine_version","dimension_results","anchor_ids","review_state"],"rules":["Parity is directional and version-pinned.","Each dimension is MATCH, MISMATCH, UNKNOWN or NOT_APPLICABLE.","Critical MISMATCH produces DENY.","Critical UNKNOWN produces REVIEW_REQUIRED.","Non-critical mismatches remain explicit and cannot be hidden by an aggregate score.","Round-trip translation is diagnostic only and cannot approve parity."]},"document_authority_contract":{"states":["RAW_REFERENCE","EXTRACTED_CANDIDATE","TRANSLATION_CANDIDATE","SEMANTIC_CANDIDATE","HUMAN_REVIEWED","ADMITTED","REVOKED","SUPERSEDED"],"actors":{"BROWSER":"ZERO_CANONICAL_AUTHORITY","CONNECTOR":"CANDIDATE_ONLY","OCR_ENGINE":"CANDIDATE_ONLY","PARSER":"CANDIDATE_ONLY","TRANSLATION_MODEL":"PROPOSAL_ONLY","SEMANTIC_MODEL":"PROPOSAL_ONLY","WORKER":"CANDIDATE_ONLY","HUMAN_DOCUMENT_AUTHORITY":"APPROVAL_ONLY","INDEPENDENT_ADMISSION_RUNTIME":"DETERMINISTIC_WRITE_AFTER_APPROVAL"},"rules":["Canonical writes require active human approval and deterministic runtime validation.","The least-authoritative input bounds every derived object.","Revoked, withdrawn, superseded or rights-denied material contributes zero to new decisions.","Human review does not waive rights, privacy, anchor or version requirements.","Tenant-private proposals cannot mutate the global admitted ledger."]},"privacy_security_contract":{"confidentiality_levels":["PUBLIC","INTERNAL","CONFIDENTIAL","RESTRICTED"],"content_flags":["PERSONAL","SENSITIVE_PERSONAL","SECRET","SOURCE_RESTRICTED","LICENSED","EXPORT_CONTROLLED"],"controls":["mime_allowlist","archive_bounds","macro_and_script_denial","malware_scan","secret_exclusion","pii_minimisation","tenant_scoped_candidate_store","sandboxed_parser","no_network_by_default","bounded_cpu_memory_time"],"rules":["Unknown classification defaults to RESTRICTED.","Secrets are not persisted in extracted text, logs, fixtures or exports.","Personal data detection proposes classification and cannot lower it.","OCR and parser processes are non-root, isolated and network-denied by default.","Document content cannot alter tools, prompts, network policy or admission decisions."]},"rights_dimensions":["collection","transient_processing","persistent_storage","model_input","derived_calculations","internal_display","customer_display","export","api_redistribution","model_training_or_evaluation"],"quality_contract":{"metrics":["native_text_coverage","ocr_character_accuracy","ocr_word_accuracy","layout_fidelity","reading_order_accuracy","table_cell_accuracy","language_segment_accuracy","anchor_resolution_rate","critical_parity_match_rate","unresolved_span_rate"],"rules":["Thresholds are language, document-class and extractor-version specific.","Unknown quality metrics do not pass.","A critical span below threshold is not masked by document-level averages.","Regression of any admitted profile suspends new materialisation.","Fixtures include born-digital, scann